{
  "$schema": "http://json-schema.org/draft-07/schema#",
  "title": "Persona",
  "type": "object",
  "required": [
    "name",
    "llm",
    "model"
  ],
  "properties": {
    "name": {
      "type": "string",
      "minLength": 1
    },
    "llm": {
      "type": "string",
      "minLength": 1
    },
    "model": {
      "type": "string",
      "minLength": 1
    },
    "engagement": {
      "type": "number",
      "minimum": 0,
      "maximum": 1
    },
    "references": {
      "type": "array",
      "items": {
        "type": "object",
        "required": [
          "type",
          "value"
        ],
        "properties": {
          "type": {
            "type": "string",
            "pattern": "^(file|url|vector:[a-zA-Z0-9:_-]+)$"
          },
          "value": {
            "type": "string",
            "minLength": 1
          }
        }
      }
    },
    "regular_prompt": {
      "type": "string"
    },
    "goal_prompt": {
      "type": "string"
    }
  },
  "additionalProperties": false
}